{
  "contract_version": "1.0.0",
  "schema_version": "public_intelligence_card.v1",
  "public_intelligence_id": "pubintel_event_structured_001",
  "receipt_id": "fc_pub_event_structured_001",
  "snapshot_version": 1,
  "generated_at": "2026-06-19T18:00:00Z",
  "author_type": "system",
  "author_display": "FoxClaw",
  "disclosure": "Generated by FoxClaw. Informational paper-only. Not individualized advice.",
  "mode": "informational_paper",
  "publication_class": "PUBLIC_SOURCE",
  "contains_private_source_content": false,
  "claim": {
    "summary": "A public event-market setup has acceptable evidence and structure.",
    "subject": "Public event contract",
    "direction_or_outcome": "yes",
    "time_horizon": "weeks",
    "why_it_matters_now": "The setup has public evidence, a defined invalidation, and acceptable terms."
  },
  "scores": {
    "attention": 54,
    "evidence_quality": 78,
    "signal_confidence": 72,
    "edge": 9,
    "tradeability": 74,
    "entry_quality": 76,
    "risk": 42,
    "plan_readiness": 84,
    "source_track_record": 68,
    "setup_track_record": 71
  },
  "risk_class": "STRUCTURED",
  "risk_classification": {
    "class": "STRUCTURED",
    "beginner_safe": true,
    "summary": "Paper-review structure is present."
  },
  "evidence": {
    "supporting": ["Public evidence is traceable and current."],
    "opposing": ["Resolution timing could still change."]
  },
  "attention": {"trend": "steady", "summary": "Attention is not driving the verdict."},
  "tradeability": {"status": "strong", "summary": "Liquidity and entry quality are acceptable."},
  "invalidation": {"summary": "Invalid if public evidence contradicts the thesis."},
  "plan_readiness": "PAPER_READY",
  "professional_wait_for": "Maintain invalidation and sizing discipline.",
  "public_explanation": {
    "what_the_claim_is": "A public event setup is structured enough for paper review.",
    "what_a_professional_would_wait_for": "Maintain invalidation and sizing discipline.",
    "not_individualized_advice": true
  },
  "status": {
    "validation": "promoted",
    "publication": "public",
    "authority": "paper_only",
    "live_execution_allowed": false
  },
  "lineage": {"public_source_ids": ["source_public_hash_020"], "receipt_hash": "sha256:structured"}
}
