{
  "contract_version": "1.0.0",
  "schema_version": "public_intelligence_card.v1",
  "public_intelligence_id": "pubintel_eth_watch_001",
  "receipt_id": "fc_pub_eth_watch_001",
  "snapshot_version": 1,
  "generated_at": "2026-06-19T18:00:00Z",
  "author_type": "system",
  "author_display": "FoxClaw",
  "disclosure": "Generated by FoxClaw. Informational paper-only. Not individualized advice.",
  "mode": "informational_paper",
  "publication_class": "DERIVATIVE_PUBLIC_SAFE",
  "contains_private_source_content": false,
  "claim": {
    "summary": "ETH has a developing upside thesis that still needs confirmation.",
    "subject": "ETH/USD",
    "direction_or_outcome": "up",
    "time_horizon": "days",
    "why_it_matters_now": "Public evidence is improving, but confirmation is incomplete."
  },
  "scores": {
    "attention": 61,
    "evidence_quality": 64,
    "signal_confidence": 62,
    "edge": 4,
    "tradeability": 58,
    "entry_quality": 51,
    "risk": 48,
    "plan_readiness": 34,
    "source_track_record": 55,
    "setup_track_record": 53
  },
  "risk_class": "WATCH",
  "risk_classification": {
    "class": "WATCH",
    "beginner_safe": true,
    "summary": "Worth watching, not yet structured."
  },
  "evidence": {
    "supporting": ["Public evidence is improving."],
    "opposing": ["Confirmation remains incomplete."]
  },
  "attention": {"trend": "steady", "summary": "Attention is steady."},
  "tradeability": {"status": "acceptable", "summary": "Conditions are watchable but not strong."},
  "invalidation": {"summary": "Watch thesis weakens if confirmation fails."},
  "plan_readiness": "DRAFT",
  "professional_wait_for": "Confirmation and a complete paper plan.",
  "public_explanation": {
    "what_the_claim_is": "ETH may develop an upside setup.",
    "what_a_professional_would_wait_for": "Confirmation and a complete paper plan.",
    "not_individualized_advice": true
  },
  "status": {
    "validation": "promoted",
    "publication": "public",
    "authority": "paper_only",
    "live_execution_allowed": false
  },
  "lineage": {"public_source_ids": ["source_public_hash_010"], "receipt_hash": "sha256:watch"}
}
