{
  "contract_version": "1.0.0",
  "schema_version": "public_intelligence_card.v1",
  "public_intelligence_id": "pubintel_redline_001",
  "receipt_id": "fc_pub_redline_001",
  "snapshot_version": 1,
  "generated_at": "2026-06-19T18:00:00Z",
  "author_type": "system",
  "author_display": "FoxClaw",
  "disclosure": "Generated by FoxClaw. Informational paper-only. Not individualized advice.",
  "mode": "informational_paper",
  "publication_class": "DERIVATIVE_PUBLIC_SAFE",
  "contains_private_source_content": false,
  "claim": {
    "summary": "A volatile setup is too risky for a public trade idea.",
    "subject": "High-volatility setup",
    "direction_or_outcome": "unclear",
    "time_horizon": "hours",
    "why_it_matters_now": "Risk is extreme relative to the available structure."
  },
  "scores": {
    "attention": 88,
    "evidence_quality": 66,
    "signal_confidence": 70,
    "edge": 2,
    "tradeability": 29,
    "entry_quality": 20,
    "risk": 96,
    "plan_readiness": 12,
    "source_track_record": 50,
    "setup_track_record": 39
  },
  "risk_class": "REDLINE",
  "risk_classification": {
    "class": "REDLINE",
    "beginner_safe": false,
    "summary": "Extreme risk blocks trade-idea framing."
  },
  "evidence": {
    "supporting": ["Some public evidence supports the thesis."],
    "opposing": ["Risk and entry quality are unacceptable."]
  },
  "attention": {"trend": "crowd_heat", "summary": "Attention is hot and unreliable."},
  "tradeability": {"status": "poor", "summary": "Tradeability is poor."},
  "invalidation": {"summary": "Invalid if volatility expands further."},
  "plan_readiness": "NOT_PLANNED",
  "professional_wait_for": "Risk compression and a real plan.",
  "public_explanation": {
    "what_the_claim_is": "The setup may be interesting but is not professionally structured.",
    "what_a_professional_would_wait_for": "Risk compression and a real plan.",
    "not_individualized_advice": true
  },
  "status": {
    "validation": "promoted",
    "publication": "public",
    "authority": "paper_only",
    "live_execution_allowed": false
  },
  "lineage": {"public_source_ids": ["source_public_hash_040"], "receipt_hash": "sha256:redline"}
}
