{
  "contract_version": "1.0.0",
  "schema_version": "public_intelligence_card.v1",
  "public_intelligence_id": "pubintel_sol_speculative_001",
  "receipt_id": "fc_pub_sol_speculative_001",
  "snapshot_version": 1,
  "generated_at": "2026-06-19T18:00:00Z",
  "author_type": "system",
  "author_display": "FoxClaw",
  "disclosure": "Generated by FoxClaw. Informational paper-only. Not individualized advice.",
  "mode": "informational_paper",
  "publication_class": "DERIVATIVE_PUBLIC_SAFE",
  "contains_private_source_content": false,
  "claim": {
    "summary": "SOL has a possible momentum setup with high uncertainty.",
    "subject": "SOL/USD",
    "direction_or_outcome": "up",
    "time_horizon": "days",
    "why_it_matters_now": "Volatility is rising faster than evidence quality."
  },
  "scores": {
    "attention": 82,
    "evidence_quality": 57,
    "signal_confidence": 58,
    "edge": 3,
    "tradeability": 52,
    "entry_quality": 47,
    "risk": 74,
    "plan_readiness": 28,
    "source_track_record": 48,
    "setup_track_record": 44
  },
  "risk_class": "SPECULATIVE",
  "risk_classification": {
    "class": "SPECULATIVE",
    "beginner_safe": false,
    "summary": "High uncertainty and incomplete planning."
  },
  "evidence": {
    "supporting": ["Momentum is visible in public market data."],
    "opposing": ["Evidence quality and plan readiness are weak."]
  },
  "attention": {"trend": "crowd_heat", "summary": "Attention is hot and may be noisy."},
  "tradeability": {"status": "acceptable", "summary": "Conditions are usable but risky."},
  "invalidation": {"summary": "Invalid if momentum fades without confirmation."},
  "plan_readiness": "NOT_PLANNED",
  "professional_wait_for": "A clearer plan and reduced volatility.",
  "public_explanation": {
    "what_the_claim_is": "SOL may have momentum, but uncertainty is high.",
    "what_a_professional_would_wait_for": "A clearer plan and reduced volatility.",
    "not_individualized_advice": true
  },
  "status": {
    "validation": "promoted",
    "publication": "public",
    "authority": "paper_only",
    "live_execution_allowed": false
  },
  "lineage": {"public_source_ids": ["source_public_hash_030"], "receipt_hash": "sha256:speculative"}
}
